<?xml version="1.0" encoding="UTF-8"?>
<!DOCTYPE employees SYSTEM "employee.dtd">
<?xml-model href="employee.xsd" type="application/xml" schematypens="http://www.w3.org/2001/XMLSchema"?>

<?xml-stylesheet href="employee.xsl" type="text/xsl"?>

<employees>

    <employee id="A2">
        <firstname>Bob</firstname>
        <lastname>Smith</lastname>
        <email>bob.smith@example.com</email>
        <phone_no>555-234-5678</phone_no>
        <position>Software Engineer</position>
        <salary>72000</salary>
        <department_id>002</department_id>
    </employee>
    <employee id="A3">
        <firstname>Carol</firstname>
        <lastname>Davis</lastname>
        <email>carol.davis@example.com</email>
        <phone_no>555-345-6789</phone_no>
        <position>HR Manager</position>
        <salary>88000</salary>
        <department_id>003</department_id>
    </employee>
    <employee id="A4">
        <firstname>Dave</firstname>
        <lastname>Lee</lastname>
        <email>dave.lee@example.com</email>
        <phone_no>555-456-7890</phone_no>
        <position>Financial Analyst</position>
        <salary>95000</salary>
        <department_id>004</department_id>
    </employee>
    <employee id="A5">
        <firstname>Emily</firstname>
        <lastname>Walker</lastname>
        <email>emily.walker@example.com</email>
        <phone_no>555-567-8901</phone_no>
        <position>Product Manager</position>
        <salary>82000</salary>
        <department_id>005</department_id>
    </employee>
    <employee id="A6">
        <firstname>Frank</firstname>
        <lastname>Martinez</lastname>
        <email>frank.martinez@example.com</email>
        <phone_no>555-678-9012</phone_no>
        <position>Sales Representative</position>
        <salary>75000</salary>
        <department_id>006</department_id>
    </employee>
    <employee id="A7">
        <firstname>Grace</firstname>
        <lastname>Wilson</lastname>
        <email>grace.wilson@example.com</email>
        <phone_no>555-789-0123</phone_no>
        <position>Customer Support Specialist</position>
        <salary>68000</salary>
        <department_id>007</department_id>
    </employee>
    <employee id="A8">
        <firstname>Henry</firstname>
        <lastname>Brown</lastname>
        <email>henry.brown@example.com</email>
        <phone_no>555-890-1234</phone_no>
        <position>Operations Manager</position>
        <salary>90000</salary>
        <department_id>008</department_id>
    </employee>
    <employee id="A9">
        <firstname>Iris</firstname>
        <lastname>Green</lastname>
        <email>iris.green@example.com</email>
        <phone_no>555-901-2345</phone_no>
        <position>Graphic Designer</position>
        <salary>70000</salary>
        <department_id>009</department_id>
    </employee>
    <employee id="A10">
        <firstname>Jack</firstname>
        <lastname>Taylor</lastname>
        <email>jack.taylor@example.com</email>
        <phone_no>555-012-3456</phone_no>
        <position>Data Scientist</position>
        <salary>77000</salary>
        <department_id>010</department_id>
    </employee>
</employees>

    
